Id,firstName,lastName,content
1,Michael,Scott,Movie Monday! The only cure I know for the Monday blues is… Varsity Blues!
2,Pam,Beesly,"Movie Monday started with training videos, but we went through those pretty fast. Then we watched a medical video. Since then, it’s been half hour installments of various movies, with the exception of an episode of Entourage, which Michael made us watch six times."
3,Jan,Levinson,How would a movie increase productivity Michael? How on earth would it do that?
4,Angela,Martin,"I know that patience and loyalty are good, and virtuous traits. But sometimes I just think you need to grow a pair."
5,Kelly,Kapoor,[clapping her hands in unison] Fashion show! Fashion show! Fashion show at lunch! Fashion show! Fashion show! Fashion show at lunch!
